{
  "event_id": "11111111-1111-4111-8111-111111111111",
  "stream_id": "22222222-2222-4222-8222-222222222222",
  "sequence": 1,
  "type": "turn.accepted",
  "turn_id": "22222222-2222-4222-8222-222222222222",
  "run_id": "33333333-3333-4333-8333-333333333333",
  "step_index": 0,
  "trace_id": "44444444-4444-4444-8444-444444444444",
  "causation_id": null,
  "ts": "2026-08-31T01:00:00+00:00",
  "payload": {}
}
