{
  "event_id": "55555555-5555-4555-8555-555555555555",
  "stream_id": "22222222-2222-4222-8222-222222222222",
  "sequence": null,
  "live": true,
  "live_seq": 1,
  "type": "turn.token",
  "turn_id": "22222222-2222-4222-8222-222222222222",
  "run_id": "33333333-3333-4333-8333-333333333333",
  "step_index": 0,
  "trace_id": "44444444-4444-4444-8444-444444444444",
  "causation_id": null,
  "ts": "2026-08-31T01:00:01+00:00",
  "payload": { "delta": "hi" }
}
